{
  "schemaVersion": 1,
  "snapshotHash": "d83129631037ed19fefb66eadb36bdf7c5da94d44b08cbccd50ef569628c3727",
  "contextHash": "e0b633c7b0f3d58e5e39b5bbe8ba1b3663cbdf47c1a4f163a465e5335277dd5b",
  "review": {
    "observations": [
      {
        "title": "Self-reported ERC-721 state cannot enforce prize custody or delivery against an untrusted prize contract",
        "description": "The factory accepts any contract that self-reports IERC721 support, activates the clone when that same configured contract calls onERC721Received with the expected arguments, and treats that contract's ownerOf response as escrow proof. After an NFT result, settleWinningTicket allocates the pot without rechecking prize custody, and releaseSponsorProceeds can pay the sponsor before the winner attempts delivery. A sponsor-controlled prize contract can therefore pass creation (or genuinely transfer the token and later pause, seize, or block it), allow sales, permit settlement and sponsor withdrawal, and then make transferFrom or ownerOf fail during redeemWinningTicket. The failed redemption atomically rolls back its local burn and flags, but it cannot roll back sponsor proceeds released in an earlier transaction. Under the stated untrusted-prize model, the winning bearer claim can be left without a bounded delivery path while 95% of gross sales has already left the raffle.",
        "severity": "high",
        "confidence": "high",
        "source": [
          {
            "path": "packages/contracts/src/RaffleFactory.sol",
            "start": 127,
            "end": 134
          },
          {
            "path": "packages/contracts/src/RaffleFactory.sol",
            "start": 154,
            "end": 178
          },
          {
            "path": "packages/contracts/src/Raffle.sol",
            "start": 304,
            "end": 345
          },
          {
            "path": "packages/contracts/src/Raffle.sol",
            "start": 375,
            "end": 381
          },
          {
            "path": "packages/contracts/src/Raffle.sol",
            "start": 416,
            "end": 430
          },
          {
            "path": "packages/contracts/src/Raffle.sol",
            "start": 533,
            "end": 557
          }
        ],
        "assumptions": [
          "The clean requirement's untrusted-prize boundary includes sponsor-controlled transfer pausing or seizure, or false ERC-165 and ownerOf responses; if prizes are instead trusted to preserve standard ERC-721 ownership and transfer semantics, this path is excluded.",
          "At least one purchase occurs, reserveEntries is met, the correct winning ticket is settled, and sponsor proceeds are released before the winner's failed redemption.",
          "The canonical quote token and VRF wrapper behave according to the trusted-dependency assumptions."
        ]
      },
      {
        "title": "Clone-isolation checks recognize only current clones of the same factory",
        "description": "Both creation-time validation and runtime destination screening consult only the current factory's isRaffle registry. A Raffle clone from another factory is absent from that registry while still reporting IERC721 support through inheritance. Concretely, factory B can accept existing clone A as a prize-token contract; transfer of an A ticket to the new B clone passes A's local destination screen, and B's expected-prize callback activates, moving an asset directly between raffle clones. A foreign clone can also be selected as sponsorRecipient or protocolTreasury, after which _transferQuote sends USDC into that clone as an unaccounted balance. The reviewed clone exposes no generic execute or rescue path for such USDC. These paths violate the absolute cross-clone isolation requirement and can strand assets, although they require a sponsor, deployer, or ticket owner to select or approve the foreign clone.",
        "severity": "low",
        "confidence": "high",
        "source": [
          {
            "path": "packages/contracts/src/RaffleFactory.sol",
            "start": 154,
            "end": 178
          },
          {
            "path": "packages/contracts/src/Raffle.sol",
            "start": 28,
            "end": 28
          },
          {
            "path": "packages/contracts/src/Raffle.sol",
            "start": 416,
            "end": 430
          },
          {
            "path": "packages/contracts/src/Raffle.sol",
            "start": 497,
            "end": 502
          },
          {
            "path": "packages/contracts/src/Raffle.sol",
            "start": 564,
            "end": 567
          },
          {
            "path": "packages/contracts/src/Raffle.sol",
            "start": 593,
            "end": 604
          },
          {
            "path": "packages/contracts/node_modules/@openzeppelin/contracts/token/ERC721/ERC721.sol",
            "start": 44,
            "end": 49
          }
        ],
        "assumptions": [
          "Two independently deployed reviewed factories and their clones exist, and neither factory registers the other's clones.",
          "A sponsor, factory deployer, or ticket owner deliberately selects or approves a foreign clone address; no external global registry reconciliation is assumed.",
          "For the payout-lock consequence, the foreign clone receives standard USDC and exposes only the reviewed code, with no separate control or rescue path."
        ]
      }
    ],
    "gaps": [
      "Source-only review: no assessed code was run; no compilation, tests, deployment, exploit, prover, scanner, or measured coverage evidence was produced or inspected.",
      "The context contains no deployment address manifest or runtime bytecode. Canonical-USDC, canonical-Chainlink-wrapper, treasury identity, and correct-chain binding therefore remain operator or deployment assumptions; the factory itself checks only code presence and six-decimal metadata for the quote token.",
      "Embedded package metadata pins OpenZeppelin 5.6.1 and Chainlink 1.5.0, but no build artifact or deployed-bytecode correspondence is available; inherited behavior was assessed only from dependency source embedded in context.json.",
      "The 300,000-gas callback limit and live wrapper request and fulfillment behavior were not measured. Source inspection shows a storage-only callback and timeout-to-refund path, but operational adequacy remains unverified.",
      "No original target tree, git history, tests, reports, scanner output, memories, peers, internet material, or external reconciliation was inspected."
    ]
  }
}
